{
  "schemaVersion": "0.1.0",
  "id": "my-sample-cartridge",
  "name": "My Sample Cartridge",
  "version": "0.1.0",
  "runtime": {
    "version": "^0.1.0",
    "transport": "auto"
  },
  "entry": "src/index.html",
  "chainId": 11155111,
  "capabilities": {
    "required": ["evm.read"],
    "optional": ["wallet.identity", "evm.write", "events.accounts", "events.capabilities"]
  },
  "permissions": {
    "contracts": [
      {
        "address": "0x0000000000000000000000000000000000000000",
        "name": "SampleTargetContract",
        "writes": true,
        "methods": []
      }
    ]
  },
  "metadata": {
    "author": "Cartridge Developer",
    "description": "Starter developer template for Console Runtime V0",
    "canonicalUrl": ""
  }
}
